{
  "version": 1,
  "date": "2026-09-27",
  "generated_at": "2026-09-27T14:20:23+02:00",
  "kind": "daily",
  "title": "27 settembre · Champions, Copilot, Pocket e novità da giocare",
  "summary": "Otto novità verificate tra AI, Digital Workplace, dispositivi e gaming: Copilot cambia forma, Pocket prepara un nuovo set e il competitivo Champions resta in primo piano.",
  "note": "Run di test completa dell’automazione: due notizie pertinenti mancanti sono state aggiunte senza duplicare gli eventi già presenti. La selezione iniziale del mattino resta separata nell’archivio.",
  "items": [
    {
      "id": "2026-09-27-champions-frankfurt-2026-day-two",
      "event_id": "champions-frankfurt-2026-day-two",
      "category": "gaming",
      "status": "NEW",
      "title": "Pokémon Champions: oggi la seconda giornata dei Regionali di Francoforte",
      "summary": "La seconda giornata dei Regionali di Francoforte comprende Pokémon Champions, oltre ai tornei TCG e GO. La diretta del videogioco è programmata dalle 09:00 italiane: la cronaca del 27 settembre rimanda all’hub delle trasmissioni.",
      "why_you_care": "Una finestra sul competitivo di Champions: incontri e scelte di squadra da seguire senza mescolare le notizie degli altri giochi Pokémon.",
      "published_date": "2026-09-27",
      "event_date": "2026-09-27",
      "verified_at": "2026-09-27T12:32:43+02:00",
      "featured": true,
      "tags": ["Pokémon Champions","competitivo","Regionali","diretta"],
      "sources": [{"name":"Serebii · cronaca del 27 settembre","type":"reputable","url":"https://www.serebii.net/news/2026/27-September-2026.shtml"}],
      "image": {"url":"https://www.serebii.net/regionals24.jpg","alt":"Banner dei Pokémon Regional Championships usato dalla fonte; non una fotografia di Francoforte","credit":"The Pokémon Company · via Serebii","source_url":"https://www.serebii.net/news/2026/27-September-2026.shtml","verification":"URL estratto dalla fonte; anteprima controllata tramite web e/o verifica HTTP indipendente. Nessuna copia locale del contenuto protetto."},
      "published_at":"2026-09-27T07:00:00+01:00"
    },
    {
      "id":"2026-09-27-chatgpt-security-history-2026-09-25","event_id":"chatgpt-security-history-2026-09-25","category":"ai","status":"NEW",
      "title":"ChatGPT aggiunge la cronologia degli accessi e della sicurezza",
      "summary":"OpenAI introduce Security history: accessi, disconnessioni e modifiche a MFA, passkey e altre impostazioni. Sul web si trova in Settings → Security and login → Security history. Orario, località e dispositivo possono essere approssimativi o non disponibili.",
      "why_you_care":"È una novità pratica per tenere sotto controllo l’account usato con ChatGPT e strumenti collegati; non è un annuncio di un nuovo modello.",
      "published_date":"2026-09-25","event_date":"2026-09-25","verified_at":"2026-09-27T12:32:43+02:00","featured":true,
      "tags":["ChatGPT","sicurezza account","OpenAI","passkey"],
      "sources":[{"name":"OpenAI · release notes","type":"official","url":"https://help.openai.com/en/articles/6825453-chatgpt-release-notes"},{"name":"OpenAI · guida alla sicurezza dell’account","type":"official","url":"https://help.openai.com/en/articles/8304786-keeping-your-openai-account-secure"}],
      "image":{"url":"https://cdn.oaistatic.com/assets/apple-touch-icon-mz9nytnj.webp","alt":"Icona ufficiale ChatGPT: identificazione della fonte OpenAI, non schermata della notizia","credit":"OpenAI · icona ufficiale ChatGPT","source_url":"https://chatgpt.com/","verification":"Icona ufficiale servita dalla CDN OpenAI. Sostituisce la favicon del centro assistenza che risultava bloccata nel browser. Verifica HTTP e browser nel workflow Verify Personal News."},
      "recency_reason":"Recupero entro 72 ore: funzione nuova di sicurezza direttamente pertinente all’uso di ChatGPT, non presente nelle edizioni precedenti."
    },
    {
      "id":"2026-09-27-minecraft-dungeons-ii-systems-podcast-2026-09-26","event_id":"minecraft-dungeons-ii-systems-podcast-2026-09-26","category":"gaming","status":"NEW",
      "title":"Action RPG: Minecraft Dungeons II racconta il nuovo sistema di esplorazione",
      "summary":"Nel podcast ufficiale del 26 settembre, Mojang descrive un mondo interconnesso, il salto per esplorare spazi verticali e nuovi sistemi di equipaggiamento. L’intervista approfondisce come queste scelte cambino esplorazione e personalizzazione del combattimento.",
      "why_you_care":"Entra nel radar per il genere action RPG e le build, non perché Minecraft sia stato aggiunto ai tre giochi monitorati per nome.",
      "published_date":"2026-09-26","event_date":"2026-09-26","verified_at":"2026-09-27T12:32:43+02:00","featured":false,
      "tags":["action RPG","build","esplorazione","cooperativa"],
      "sources":[{"name":"Xbox Wire · intervista a Mojang","type":"official","url":"https://news.xbox.com/en-us/2026/09/26/minecraft-dungeons-ii-the-sift-new-mechanics-better-exploration-and-more-official-xbox-podcast/"}],
      "image":{"url":"https://xboxwire.thesourcemediaassets.com/sites/2/2026/09/Wire_EP286-3c39b574eab193c9cbae.jpg","alt":"Banner di Minecraft Dungeons II per il podcast ufficiale Xbox","credit":"Xbox / Mojang","source_url":"https://news.xbox.com/en-us/2026/09/26/minecraft-dungeons-ii-the-sift-new-mechanics-better-exploration-and-more-official-xbox-podcast/","verification":"URL estratto dalla fonte; anteprima controllata tramite web e/o verifica HTTP indipendente. Nessuna copia locale del contenuto protetto."},
      "published_at":"2026-09-26T18:00:00+00:00"
    },
    {
      "id":"2026-09-27-champions-global-challenge-2027-i-battles","event_id":"champions-global-challenge-2027-i-battles","category":"gaming","status":"NEW",
      "title":"Champions: la Global Challenge 2027 I si chiude nella notte",
      "summary":"Sono in corso le lotte in doppio con regolamento M-C. La finestra di gioco termina il 28 settembre alle 03:59 italiane; chi completa almeno tre incontri riceve Archaludon. La notizia riguarda la fase di lotta: non implica che le iscrizioni siano ancora aperte.",
      "why_you_care":"Una scadenza concreta per chi è già iscritto, con regolamento e ricompensa da controllare prima della chiusura.",
      "published_date":"2026-09-25","event_date":"2026-09-25","verified_at":"2026-09-27T12:32:43+02:00","featured":false,
      "tags":["Pokémon Champions","Global Challenge","regolamento M-C","scadenza"],
      "sources":[{"name":"Serebii · cronaca del 25 settembre","type":"reputable","url":"https://www.serebii.net/news/2026/25-September-2026.shtml"}],
      "image":{"url":"https://www.serebii.net/pokemonchampions/onlinecompetitions/globalchallenge2027i.jpg","alt":"Banner ufficiale Global Challenge 2027 I","credit":"The Pokémon Company · via Serebii","source_url":"https://www.serebii.net/news/2026/25-September-2026.shtml","verification":"URL estratto dalla fonte; anteprima controllata tramite web e/o verifica HTTP indipendente. Nessuna copia locale del contenuto protetto."},
      "recency_reason":"Recupero entro 72 ore: evento del gioco esplicitamente seguito e finestra di lotta ancora attiva, prossima alla chiusura.",
      "published_at":"2026-09-25T03:00:00+01:00"
    },
    {
      "id":"2026-09-27-windows-insider-2026-09-25-phone-companion","event_id":"windows-insider-2026-09-25-phone-companion","category":"devices","status":"NEW",
      "title":"Windows Insider: più attività dello smartphone nel menu Start",
      "summary":"Le build del 25 settembre aggiornano i canali Beta ed Experimental. In Experimental, Phone companion mostra più attività recenti in un pannello scorrevole; arrivano anche suggerimenti energetici nelle impostazioni rapide. Sono funzioni in anteprima, non un rilascio generale per tutti i PC.",
      "why_you_care":"Rilevante per l’integrazione Windows–smartphone. La notizia non è un invito a installare build sperimentali sul computer principale.",
      "published_date":"2026-09-25","event_date":"2026-09-25","verified_at":"2026-09-27T12:32:43+02:00","featured":false,
      "tags":["Windows 11","Android","Phone companion","Insider"],
      "sources":[{"name":"Microsoft · Windows Insider","type":"official","url":"https://blogs.windows.com/windows-insider/2026/09/25/announcing-new-builds-for-25-september-2026/"}],
      "image":{"url":"https://winblogs.thesourcemediaassets.com/sites/44/2026/09/9d-startmenu-phonecompanion.png","alt":"Schermata ufficiale del menu Start con il pannello scorrevole Phone companion","credit":"Microsoft","source_url":"https://blogs.windows.com/windows-insider/2026/09/25/announcing-new-builds-for-25-september-2026/","verification":"URL estratto dalla fonte; anteprima controllata tramite web e/o verifica HTTP indipendente. Nessuna copia locale del contenuto protetto."},
      "recency_reason":"Recupero entro 72 ore: integrazione fra Windows e smartphone pertinente ai dispositivi seguiti, non già segnalata.",
      "published_at":"2026-09-25T17:02:08+00:00"
    },
    {
      "id":"2026-09-27-xbox-september-28-october-2-2026-rpg-retro-lineup","event_id":"xbox-september-28-october-2-2026-rpg-retro-lineup","category":"gaming","status":"NEW",
      "title":"RPG e recuperi dal passato: cosa arriva su Xbox la prossima settimana",
      "summary":"Il calendario Xbox del 25 settembre segnala Gothic II Complete Classic e l’RPG gestionale Keep Driving per il 28 settembre, oltre a Dynasty Warriors 3: Complete Edition Remastered per il 1º ottobre. Sono date annunciate per Xbox, soggette a variazioni.",
      "why_you_care":"Una selezione per generi e retrogaming: recuperi di catalogo, progressione e scelte di gioco, senza trasformare ogni titolo in una watchlist individuale.",
      "published_date":"2026-09-25","event_date":"2026-09-25","verified_at":"2026-09-27T12:32:43+02:00","featured":false,
      "tags":["Xbox","RPG","retrogaming","riedizioni","uscite"],